0 |Mas quem dirá se será pacto democrático ou luta aberta será a burguesia que deu o golpe!".
PublicidadeDentro da estratégia de blindagem do ex-presidente Luiz Inácio Lula da Silva, o presidente do PT do Rio, Washington Quaquá, divulgou nesta segunda-feira (26), uma nota em que prega "confronto popular aberto nas ruas" caso o petista seja condenado pelo juiz Sergio Moro.
"Queremos, a partir do Rio de Janeiro, dizer em alto e bom som: condenar Lula sem provas é acabar de vez com a democracia!
No te| |Medio| |Manifestacao|
1 |Assinado pela presidente nacional do partido, Gleisi Hoffmann, o texto diz que o objetivo de uma eventual condenação é afastar Lula das eleições de 2018.
O texto do PT relata, ainda, que a militância está atenta e mobilizada para dar a “resposta adequada” para uma eventual condenação.
Uma hipotética condenação de Lula teria como único objetivo afastá-lo das eleições de 2018, o que é absolutamente inaceitável.
Gleisi afirma que o Congresso tem aprovados “propostas contra os trabalhadores” e diz q| |Medio| |Politica|
2 |PolíticaO deputado federal Vicente Cândido (PT-SP) afirmou que não há "grande preocupação" dele, do partido e do ex-presidente Luiz Inácio Lula da Silva com a eventual delação premiada do ex-ministro Antonio Palocci.
O parlamentar disse ainda que esperava uma pena maior na sentença proferida hoje pelo juiz Sérgio Moro condenando Palocci a 12 anos e 2 meses de prisão.
Moro condenou Antonio Palocci a 12 anos e 2 meses de prisão pelos crimes de corrupção passiva e lavagem de dinheiro.
"Até achei qu| |Alto| |Corrupcao|
3 |Trata-se do célebre caso do apartamento tríplex do Guarujá, visitado por Lula e seus familiares em companhia de Léo Pinheiro, ex-presidente da construtora OAS.
Não há como prever o resultado desse processo, que, na hipótese condenatória, conhece ainda amplo caminho para recursos judiciais.
O julgamento deste caso específico não se confunde com o juízo final; é uma pequena etapa, mais uma, de um processo de depuração sem data marcada para terminar.
Neste último aspecto, deve ser lembrado que mesm| |Medio| |Processo-Juridico|
4 |Pesquisa divulgada na semana passada pelo site Poder360 apontou Lula e o deputado federal Jair Bolsonaro (PSC-RJ) no segundo turno da eleição presidencial.
Os tucanos não passariam para o segundo turno nem com Geraldo Alckmin, com 7%, nem com o prefeito de São Paulo, João Doria, que teria 11%.
O petista com 27%, e Bolsonaro com 14%.
247 - Líder em todas as pesquisas eleitorais, o ex-presidente Luiz Inácio da Lula da Silva afirmou que os transmissores do ódio "não estão colhendo" o senador Aécio | |Baixo| |Eleicoes|
5 |Uma hipotética condenação de Lula teria como único objetivo afastá-lo das eleições de 2018, o que é absolutamente inaceitável.
Segundo o partido presidido pela senadora Gleisi Hoffmann, uma hipotética condenação de Lula teria como único objetivo afastá-lo das eleições de 2018, "o que é absolutamente inaceitável".
"Sem Lula, as eleições presidenciais não terão legitimidade e não passarão de uma fraude contra o povo brasileiro", diz o PT.
Sem Lula, as eleições presidenciais não terão legitimidade | |Medio| |Politica|
6 |O que nós queremos é que não inviabilizem o nosso presidente Lula de ser candidato.
"Para nós, 2018 está logo ali, já começou.
Militantes favoráveis a ela ainda gritaram diversas vezes "retira", para que Lindbergh desistisse de sua candidatura.
"E meu candidato é Lula para presidente", avisou.
Toda vez que a gente faz um discurso, tem que chegar em casa e colocar na balança e saber se ele é exequível", explicou.| |Medio| |Manifestacao|
7 |"Eu estou quase falando: 'Moro, meu amigo Moro, o Joesley disse que eu tenho US$ 82 milhões.
"Nunca o Brasil precisou tanto do PT como está precisando agora", disse neste sábado (10), em evento de posse do diretório paulista do PT na Assembleia Legislativa do Estado de São Paulo.
Nesse contexto, ela denunciou uma "caçada" ao ex-presidente Lula, réu na Lava Jato.
Se você quiser que eu faça uma delaçãozinha e você me der US$ 41 milhões, eu faço.
O primeiro que eu entrego é ele", falou.| |Alto| |Crime|
8 |Repetiu que, "se for necessário, será candidato" e disse que, neste cenário, "a possibilidade de ganhar as eleições é muito grande".
Lula disse, ainda, que não se arrepende de ter feito aliança com o PMDB enquanto estava na Presidência.
"O Temer pode cair, mas um processo qualquer que aconteça contra um presidente ou contra qualquer ser humano precisa ser investigado", disse à rádio.
Até um presidente da República foi grampeado e gravado da forma mais ilegal possível", disse.
Para o petista, Tem| |Alto| |Processo-Juridico|
9 |O MPF pedirá o aumento da pena de Palocci e do ex-tesoureiro do PT, João Vaccari Neto, que também foi condenado no mesmo processo.
O ex-tesoureiro do PT foi acusado pelo Ministério Público Federal de envolvimento em esquema bilionário de pagamento de propinas em licitações para obras da Petrobras.
Vaccari foi acusado de articular repasses de ao menos R$ 4,3 milhões da propina para o PT, inclusive por meio de doações oficiais.
O PT também se manifestou.
A decisão no processo contra Vaccari foi to| |Alto| |Corrupcao|
10 |“Eu não tenho dúvida de que o nome do companheiro presidente Lula, que fez história neste País, é o grande nome para ser candidato a presidente da República pelo PT e pela esquerda”, discursou.
Da esquerda para a direita: José Guimarães, Gleisi Hoffmann, Camilo Santana e De Assis Diniz MATEUS DANTAS O governador Camilo Santana (PT) disse ontem que Lula é o grande nome do PT para ser candidato no ano que vem.
“É inadmissível um candidato a governador que quer a legenda do PT, que quer continuar n| |Baixo| |Eleicoes|
11 |O representante da Granero e o próprio Léo Pinheiro (ex-presidente da OAS) atestam não haver qualquer crime quanto ao fato.
Segundo o banco, o FGTS adquiriu debêntures da OAS garantidos pela hipoteca do prédio, de propriedade da construtora.
Para a defesa, isso mostra que a OAS não tinha como ceder a propriedade ou prometer a posse ao ex-presidente, o que invalidaria a acusação do Ministério Público Federal.
Valeska Martins, que também defende Lula, disse que não lhe "parece que Marisa fosse inc| |Medio| |Processo-Juridico|
12 |E o Janot, petista, também não quer a reforma para o Lula voltar”, disse Perondi no vídeo.
O vice-líder elogiou o discurso do presidente e afirmou que Temer não aceita a produção de provas ilícitas para incriminá-lo.
Perondi encaminhou uma mensagem aos deputados convocando a base governista para demonstrar apoio ao presidente Temer durante o pronunciamento oficial.
Acreditem.” Na descrição da publicação, em sua conta oficial no Facebook, o deputado escreveu que “Janot trabalha para eleger o Lula| |Medio| |Politica|
13 |Depois de praguejar contra Lindbergh por ele ter enfrentado Gleisi, o ex-presidente impôs o nome do senador para líder do partido na Casa.
Esses dias, o ex-presidente, que pediu a ele para desistir do plano e apoiar Gleisi Hoffmann, sentenciou a interlocutores: “Esse menino não tem futuro”.
Lindbergh Farias ganhou espaço cativo na caixinha de mágoas de Lula desde que se recusou a abandoar a disputa pela presidência do PT.
A bancada do PT no Senado está enfurecida com Lula.| |Medio| |Politica|
14 |No entanto, disse que nunca tratou de valores com Lula, que eram definidos por representantes do PT e da Odebrecht.
Emílio Odebrecht (Foto: Editora Globo)Em depoimento ao juiz Sérgio Moro, o empresário Emílio Odebrecht afirmou que o ex-presidente Lula fez pedidos de contribuições eleitorais da Odebrecht ao PT durante as reuniões que ambos faziam durante o mandato do petista.
Ressaltou ainda que Emílio Odebrecht esclareceu que sempre teve uma "relação cerimoniosa" com Lula e que jamais tratou de | |Alto| |Corrupcao|
15 |Por Eugênio BucciÀ custa de golfadas de mau gosto, a República do Brasil se repete não como farsa, mas como paródia.
O que importa é privatizar o que é público, mesmo que para isso seja preciso fazer uma coisinha ou outra.
Os reformistas eram socialistas sinceros, apenas não apostavam no uso da violência para, como gostavam de dizer, transformar a sociedade.
Ao comentar o caso do agente policial Roman Malinovski, que se infiltrou no partido e chegou a fazer parte do comitê central, ele reafirma | |Medio| |Politica|
16 |“Eu avalio que o (ex-presidente) Lula é um candidato forte.
Em entrevista ao Notícia da Manhã, desta segunda-feira (26), Wellington Dias comentou que chegou a alertar Lula sobre um possível atentado.
Nós tivemos uma situação em que se tirou uma presidente legitimamente eleita pelo voto popular, sem cometer crime.
Algumas pessoas do meu partido foram condenadas, umas injustamente como o José Genuíno; é lamentável que um dia a história vai reparar.
“Cada vez mais pessoas compreendem o significado | |Alto| |Crime|
17 |Palocci, a ponte do PT com o mercado e os escândalos1 de 2 (Arquivo) Foto tirada em 7 de junho de 2011 mostra o ex-ministro da Economia Antonio Palocci, em Brasília - AFP/ArquivosAntonio Palocci sempre conseguiu renascer das cinzas.
Médico de profissão, o influente ex-ministro de 56 anos foi um hábil estrategista no complexo jogo de xadrez de interesses e partidos sobre os quais foram montados os governos do PT.
“Pessoas com a competência política de Palocci não surgem todos os dias, nem todos o| |Baixo| |Politica|
18 |De acordo com o blogueiro, "fica patente também o fracasso da dobradinha de Sergio Moro com a mídia.
A mais recente, encomendada pelo Poder360, traz o petista em primeiro com 27% nos 2 cenários testados", lembrou o jornalista.
De acordo com o levantamento, o PT é o favorito de 18% da população, na maior popularidade desde a segunda posse de Dilma, em 2015.
247 - Jornalista kiko Nogueira, do Diario do Centro do Mundo, avalia que a pesquisa Datafolha, divulgada neste domingo (25), revela Michel Te| |Baixo| |Eleicoes|
20 |Em maio deste ano, o colunista Lauro Jardim também havia reiterado que Temer tinha feito a promessa a Sarney que jamais nomearia Nicolao.
Maranhão 247 - Michel Temer já decidiu: não vai nomear o procurador Nicolao Dino para suceder Rodrigo Janot no comando da Procuradoria Geral da República.
Nicolao Dino foi o mais votado na lista tríplice do Ministério Público divulgada nesta terça-feira (27).
Mas, de acordo com a revista Veja, Temer já avisou que não vai escolher Nicolao.
É que Nicolao é irmão| |Baixo| |Politica|
21 |"Há meses Temer disse que se um ministro do seu governo fosse denunciado ele seria imediatamente afastado.
Após a votação, se o plenário do Supremo decidir aceitar a denúncia, Temer vira réu e terá de se afastar do cargo por até 180 dias.
Está na hora de Temer se auto aplicar esse princípio", disparou a deputada mineira.
Michel Temer disse, no dia 13 de fevereiro que afastaria do governo qualquer ministro denunciado na Operação Lava Jato.
A partir da denúncia, o ministro Edson Fachin, do STF, ac| |Alto| |Corrupcao|
22 |É a primeira vez na história do Brasil que um presidente no cargo é acusado de cometer um crime comumPubProcuradoria entende que o presidente recebeu suborno.
Tal como há um ano e meio, a Câmara dos Deputados do Brasil vai voltar a decidir se derruba ou não um presidente da República.
Pauderney Avelino, do DEM, da base aliada do governo, disse que Temer "está ansioso para mostrar a sua inocência".
Horas antes de o PGR apresentar a acusação, o presidente da República dissera estar firme.
Fernando| |Alto| |Corrupcao|
23 |PesquisaO PT atingiu a sua maior popularidade desde a segunda posse da ex-presidente Dilma Rousseff, em 2015, segundo pesquisa Datafolha publicada neste domingo (25) pela Folha de S.Paulo.
Além de PT, PSDB e PMDB, apenas PSOL, PV e PDT pontuaram na pesquisa, com 1% cada.
Até junho de 2015, quando empatou tecnicamente com o PSDB, o PT era líder de popularidade no país.
A alta na popularidade petista ocorre em meio à crise política que atinge Michel Temer.
O auge do índice ocorreu em março de 2013| |Baixo| |Eleicoes|
24 |BNDESCriado pelo governo brasileiro em 2008 e administrado pelo BNDES, o Fundo Amazônia já recebeu R$ 2,85 bilhões, de três doadores: o governo da Noruega (R$ 2,77 bilhões), o governo da Alemanha (R$ 60,69 milhões) e a Petrobrás (R$ 14,70 milhões).
O fundo tem como base um acordo de 2008 que diz que quando um desmatamento aumenta, o dinheiro é cortado.
A Noruega é o maior doador ao Fundo da Amazônia e já destinou ao Brasil US$ 1,1 bilhão.
O anúncio foi feito nesta quinta-feira, 22, em uma reuniã| |Baixo| |Positiva|
25 |Esses fatores que o levaram a pensar em se afastar da vida pública e se dedicar somente à literatura.
Em 2009, Sarney foi escolhido para mais um período à frente da Casa, mas enfrentou turbulências no mandato.
Paralelamente à política, Sarney tem uma trajetória literária, que lhe deu o título de imortal da Academia Brasileira de Letras (ABL).
Sarney também se beneficiou pela nova Carta, após negociar com o Congresso o aumento do mandato do presidente para cinco anos.
Em nota, Sarney se defendeu | |Baixo| |Politica|
26 |247 – "O veredito nada tem de judicial, mas Michel Temer (PMDB) foi condenado de modo implacável pela opinião pública no caso JBS.
Leia, abaixo, editorial deste domingo:Rejeição implacávelO veredito nada tem de judicial, mas Michel Temer (PMDB) foi condenado de modo implacável pela opinião pública no caso JBS.
O desalento reflete-se na imagem que se tem do país.
Para 76%, Temer deveria renunciar ao cargo.
Existem ainda temores de que uma nova troca de comando no Planalto dificultaria a recuperaç| |Alto| |Corrupcao|
27 |Foi vaga, sem conteúdo, a resposta do nosso ministro do meio ambiente, José Sarney Filho.
Outras medidas que liberam a venda de terras para estrangeiros e autorizam o uso indiscriminado de agrotóxicos já foram anunciadas por integrantes do governo.
A sociedade civil, porém, preparou uma réplica bem mais substancial à questão, muito menos otimista, um manifesto de cobrança.
Teorias sólidas sobre crescimento e preservação, sobre desigualdade social, sobre pobreza, sobre as maiores vítimas do desca| |Alto| |Dano-Ambiental|
28 |"Eu vi [apenas] a notícia da denúncia, soube que vai ser uma denúncia a prazo, vamos ter capítulos de denúncias, vai ser um seriado.
O líder do governo no Senado, Romero Jucá (PMDB-RR), ironizou hoje (27) o possível fatiamento da denúncia apresentada contra o presidente Michel Temer pela Procuradoria-Geral da República (PGR).
Para a denúncia ser analisada pelo STF, é preciso que ao menos 342 deputados, o equivalente a dois terços da Câmara, aceitem o pedido da PGR.
Ontem (26), o procurador-geral| |Alto| |Processo-Juridico|
29 |Agora, ele explica, "existe uma decepção pelo fato de que uma melhoria econômica indiscutível não foi seguida de uma melhoria ética, o que desanima".
O que se escuta em jantares de família, em bares, em supermercados, em comércios ou cabeleireiros é quase sempre o mesmo: “adianta alguma coisa”?
O gigante, que parecia acordado, voltou a adormecer.
Aqueles que estavam em relativo contato nas redes e nas ruas em 2013 não têm mais contato.
São sindicatos, carros de som, os slogans... Uma linguagem a| |Medio| |Manifestacao|
30 |Além do ex-senador Delcídio Amaral (ex-PT-MS) e de outros processos em que Aécio foi alvo.
Aliado de José Sarney e de Renan Calheiros, João Alberto Souza foi reconduzido à presidência do Conselho de Ética pela tropa de choque do PMDB.
O senador João Alberto Souza (PMDB-MA) foi eleito pela 6ª vez consecutiva (o que equivale a 12 anos) presidente do Conselho de Ética do Senado Federal.
Em abril de 2009, Souza se tornou vice-governador de Roseana Sarney, que assumiu o cargo após a cassação de Jacks| |Baixo| |Politica|
31 |O Brasil vai emergir da escuridão muito melhor.
Para que a nação devastada pelos poderosos patifes recuperasse a saúde, era preciso remover cirurgicamente o tumor da corrupção institucionalizada.
Já não são poucos os figurões da política transformados em vizinhos de cela de empresários especialistas em bandalheiras.
Tantos números desoladores avisam que o Brasil vai ficar na UTI por muito tempo, certo?
As descobertas da Lava Jato transformaram em casos de polícia o presidente Michel Temer e quat| |Alto| |Corrupcao|
32 |65% acham que o melhor para o País é que Temer deixe o Palácio do Planalto imediatamente.
Aprovado por apenas 7% da população, Temer alcançou a menor marca registrada pelo Datafolha em 28 anos, perdendo apenas para José Sarney (PMDB), em 1989, que teve aprovação de somente 5% da população, em meio à crise da hiperinflação.
Nunca um presidente destruiu tantos direitos sociais e econômicos da população como o ilegítimo Temer.
É uma crescente impopularidade, ainda mais que a população vê cenas dant| |Alto| |Politica|
33 |"Pode virar um governo fraco, ainda que resistente até o fim do mandato (em 2018)", opina à BBC Brasil o cientista político Claudio Couto, da FGV-SP.
"Quanto mais fraco um governo, mais ele tem que ceder (nas negociações com o Congresso)", explica Couto.
"Um governo mal avaliado tende a levar o eleitor a buscar alternativas distantes do governismo.
"A briga do governo Temer, agora, será agora para evitar a 'sarneyzação'.
É um risco considerável que o governo corre, mas que pode ser evitado porqu| |Alto| |Politica|
34 |Um "outsider" finalista da eleição de 1989 era um aventureiro, mas o outro era o líder do primeiro partido popular de esquerda do Brasil, Lula do PT (não se faça muxoxo, trata-se de 1989).
Um pedido de impeachment de Sarney, derivado de uma "CPI da Corrupção", seria arquivado pela Câmara em 1989, por falta de "provas conclusivas".
Os tucanos eram de fato o "Bloco Independente" do PMDB, que em junho daquele 1988 passaria a ser o PSDB.
Virá um 1989 piorado?
O presidente era José Sarney; a duração | |Medio| |Corrupcao|
35 |É a primeira vez na história do Brasil que um presidente no cargo é acusado de cometer um crime comumPubProcuradoria entende que o presidente recebeu suborno.
Tal como há um ano e meio, a Câmara dos Deputados do Brasil vai voltar a decidir se derruba ou não um presidente da República.
Pauderney Avelino, do DEM, da base aliada do governo, disse que Temer "está ansioso para mostrar a sua inocência".
Horas antes de o PGR apresentar a acusação, o presidente da República dissera estar firme.
Fernando| |Alto| |Corrupcao|
36 |BNDESCriado pelo governo brasileiro em 2008 e administrado pelo BNDES, o Fundo Amazônia já recebeu R$ 2,85 bilhões, de três doadores: o governo da Noruega (R$ 2,77 bilhões), o governo da Alemanha (R$ 60,69 milhões) e a Petrobrás (R$ 14,70 milhões).
O fundo tem como base um acordo de 2008 que diz que quando um desmatamento aumenta, o dinheiro é cortado.
A Noruega é o maior doador ao Fundo da Amazônia e já destinou ao Brasil US$ 1,1 bilhão.
O anúncio foi feito nesta quinta-feira, 22, em uma reuniã| |Baixo| |Positiva|
37 |247 – "O veredito nada tem de judicial, mas Michel Temer (PMDB) foi condenado de modo implacável pela opinião pública no caso JBS.
Leia, abaixo, editorial deste domingo:Rejeição implacávelO veredito nada tem de judicial, mas Michel Temer (PMDB) foi condenado de modo implacável pela opinião pública no caso JBS.
O desalento reflete-se na imagem que se tem do país.
Para 76%, Temer deveria renunciar ao cargo.
Existem ainda temores de que uma nova troca de comando no Planalto dificultaria a recuperaç| |Alto| |Corrupcao|
38 |Um "outsider" finalista da eleição de 1989 era um aventureiro, mas o outro era o líder do primeiro partido popular de esquerda do Brasil, Lula do PT (não se faça muxoxo, trata-se de 1989).
Um pedido de impeachment de Sarney, derivado de uma "CPI da Corrupção", seria arquivado pela Câmara em 1989, por falta de "provas conclusivas".
Os tucanos eram de fato o "Bloco Independente" do PMDB, que em junho daquele 1988 passaria a ser o PSDB.
Virá um 1989 piorado?
O presidente era José Sarney; a duração | |Alto| |Corrupcao|
39 |BNDESCriado pelo governo brasileiro em 2008 e administrado pelo BNDES, o Fundo Amazônia já recebeu R$ 2,85 bilhões, de três doadores: o governo da Noruega (R$ 2,77 bilhões), o governo da Alemanha (R$ 60,69 milhões) e a Petrobrás (R$ 14,70 milhões).
O fundo tem como base um acordo de 2008 que diz que quando um desmatamento aumenta, o dinheiro é cortado.
A Noruega é o maior doador ao Fundo da Amazônia e já destinou ao Brasil US$ 1,1 bilhão.
O anúncio foi feito nesta quinta-feira, 22, em uma reuniã| |Baixo| |Positiva|
40 |A notícia ruim é que a receita combinada dos cinco maiores fornecedores caiu US $ 8,8 bilhões em 2016.
Abaixo, portanto, dos US $ 235 bilhões alcançados em 2015, muito em função da queda de vendas dos tablets e smartphones.
De acordo com o Gartner, a receita da empresa foi de mais de US $ 218 bilhões em 2016.
O Gartner apresentou nesta quinta-feira, 22/6, a lista dos 100 principais fornecedores globais em TI em 2016, em um relatório baseado em suas receitas em TI (excluindo serviços de comunicaç| |Baixo| |Positiva|
41 |No caso de um hospital ou um banco, o serviço pode distribuir senhas de atendimento.
O segmento de B2B da Oi encolheu no último trimestre, na comparação anual, em função da crise econômica.
Lojas do varejo terão um conjunto de aplicações diferentes do que um hospital.
A companhia obteve um crescimento de receita em TI de 22% em 2016, em comparação ao ano anterior, patamar superior ao do mercado.
O desenvolvimento do produto faz parte dos investimentos em TI para o mundo corporativo feitos pela O| |Baixo| |Positiva|
42 |A pesquisa revela também que os negócios enfrentam outros desafios de transformação digital para garantir que os objetivos estejam alinhados.
Para baixar o e-book e saber mais sobre a necessidade de automação dos negócios digitais, clique aqui.
Nosso conjunto de soluções de TI – “Digital Enterprise Management” – foi desenvolvido para tornar os negócios digitais rápidos, contínuos e otimizados.
Apesar dos novos desafios e oportunidades associados com a automação dos negócios digitais, o estudo co| |Baixo| |Positiva|
43 |O programa unifica todos os recursos de marketing digital da HPE para parceiros tornando mais fácil e rápido o acesso e utilização.
Para ajudar os parceiros a se adaptarem à realidade de criar um portfólio no mundo digital de hoje, a HPE introduziu o programa HPE Partner Ready Digital Marketing.
Essas soluções previamente definidas, com base em metodologias comprovadas da HPE, ajudam os parceiros a oferecer novas tecnologias com rapidez e com custo reduzido para os clientes.
· Capacitação: Acele| |Baixo| |Positiva|
44 |Periodicamente, Satyanatha dará aulas, mas a proposta é que a sala tenha livre uso e que os funcionários possam usar o Vivo Meditação, que é gratuito para todos que trabalham na companhia.
A Vivo convida seus funcionários a aproveitar mais as boas coisas da vida, dedicando atenção àquilo que mais importa.
Vale o que a pessoa sentir bem para usar na ocasião em que estará presente.
O serviço conta com mais de mil meditações e aulas exclusivas, criadas e gravadas por Satyanatha especialmente para o| |Baixo| |Positiva|
45 |Com isso, chegará a 77 cidades com cobertura 4G+, que é até duas vezes mais rápida que o 4G atual.
INTERNET MAIS RÁPIDA - Com o 4G+, os clientes da Vivo podem navegar na internet, baixar vídeos, músicas e subir fotos para as redes sociais com muito mais rapidez.
Para oferecer internet até duas vezes mais rápida, a Vivo agrega até três frequências 4G disponíveis em cada um dos municípios.
A empresa está presente em 3,9 mil cidades, sendo mais de 3,7 mil com rede 3G e mais de mil com 4G, segmento | |Baixo| |Positiva|
46 |Durante o Citrix Synergy, a companhia lançou a Citrix Analytics, plataforma de segurança e analytics entregue através da Citrix Cloud.
*Jornalista participou do Citrix Synergy 2017 à convite da Citrix Brasil
Luis Banhara, Country Manager da Citrix Brasil, é mais categórico: “Nós somos uma empresa de segurança”, ressalta em entrevista exclusiva à Computerworld Brasil.
Em seu keynote, o CEO Kirill Tatarinov ressaltou que a Citrix caminha "para se tornar uma verdadeira ponte de segurança para as em| |Baixo| |Positiva|
47 |O ponto focal da transformação é a compreensão, pelo CEO e demais executivos, do quão imperiosa é essa transformação para a sobrevivência do negócio.
Muitas vezes, ao indagar aos executivos o que significa Transformação Digital para sua empresa, recebo respostas variadas, e muitas delas demonstrando claramente que a “ficha não caiu”.
Não existe transformação dos negócios sem que as pessoas mudem seu comportamento.
O ponto de inflexão, o momento na vida de uma empresa em que os seus fundamentos b| |Baixo| |Positiva|
48 |Em um deles, acabou reencontrando um colega, em julho de 2016.
Outro “legado” que os dois elegem é a percepção do que não fazer no longo caminho do empreendedorismo.
Outra prática que também é resultado desta fase da empresa é a de fazer visitas regulares a clientes e possíveis clientes.
Na comunicação visual, o antigo homenzinho da Encontre um Nerd está sendo trocado por um par de óculos.
É SOBRE NÃO PARAR DE EVOLUIRA fase de mudanças também atingiu o nome da startup, que passou a se chamar Eun| |Baixo| |Positiva|
49 |Marketing de conteúdo é cada vez mais importante para os resultados de negócios de empresas B2B no Brasil.
