Ainda segundo Toron, a conversa entre Aécio e Joesley trata do oferecimento da compra de um imóvel da família d| |Alto| |Processo-Juridico|
243 |Outro irmão de Silval, Antônio da Cunha Barbosa Filho, recebeu R$ 255,1 mil da JBS em 2011.
O médico e empresário Rodrigo Barbosa, filho de Silval, recebeu R$ 470,8 mil da JBS em sua conta, em três transferências.
Conforme o relatório da Defaz, o administrador da rádio de Rodrigo e Roseli recebeu quatro transferências da JBS em sua conta, de fevereiro a agosto de 2011.
Quebra de sigiloConforme o relatório, o familiar de Silval que recebeu os maiores valores do frigorífico foi seu irmão Cláudio d| |Alto| |Crime|
244 |A permissão para a venda havia sido solicitada pelas defesas dos irmãos Joesley e Wesley Batista, donos da JBS.
A venda das subsidiárias na Argentina, no Paraguai e no Uruguai não estavam incluídas no plano divulgado ontem pela JBS.
O bloqueio de ativos da JBS foi imposto como medida cautelar pelo magistrado.
Soares Leite é o juiz responsável pela Operação Bullish, na qual são investigados desvios no Banco Nacional de Desenvolvimento Econômico e Social (BNDES) em favor da empresa.
Na decisão div| |Alto| |Corrupcao|
245 |BNDES diz que acompanha venda de ativos do JBS para proteger interesses do bancoO presidente do BNDES, Paulo Rabello de Castro, entrou em contato com o blog para dizer que o banco e especialmente o BNDESPar estão atentos sobre as negociações de venda de ativos do grupo JBS.
"Os sócios da empresa estão atentos — mas especialmente o BNDESPar, que está agindo hoje mesmo para garantir que nada ocorra nesse sentido de haver desvio de valor de ativos da empresa para os controladores", disse Castro.
A | |Medio| |Positiva|
246 |Eles são acusados de atrapalharem investigações feitas pela Procuradoria da República no Distrito Federal contra o frigorífico JBS.
O procurador teria sido cooptado pelo advogado Willer Tomaz, que ofereceu seus serviços à JBS.
A prisão foi pedida pelo procurador-geral da República, Rodrigo Janot, e determinada pelo ministro Edson Fachin, relator dos processos da Operação Lava-Jato no STF.
O ministro Ricardo Lewandowski - Ueslei Marcelino / ReutersBRASÍLIA — A defesa do procurador da República Ân| |Alto| |Processo-Juridico|
247 |na CBNInflação recua mais em junhoAcompanhe o resumo da semana:IPCA-15 — a inflação até meados de junho caiu para 0,16% e acumula agora 3,52% em um ano.
Relatório de inflação — a expectativa do BC é que a inflação acumulada em um ano continue caindo nos próximos meses e termine agosto em 2,73%.
O texto, que havia sido aprovado na CAE, de assuntos econômicos, agora segue para a CCJ e em seguida para o plenário.
A proibição pode provocar um efeito em cadeia em outros países.
O mercado de lá havia | |Medio| |Economia|
248 |Documento ‘GRAVÍSSIMA SUBVERSÃO’ PDFA delação da JBS mergulhou o governo Michel Temer em sua pior crise.
Isso porque a jurisprudência do Tribunal é no sentido do não cabimento de habeas corpus em tal hipótese.
Ele destacou que a jurisprudência do STF tem acentuado a inviabilidade do habeas corpus impetrado em favor de ‘terceiros não identificados’.
“Inexiste, na realidade, em nosso sistema de direito positivo, a figura do habeas corpus pro societate”, lembrou.
Segundo Celso de Mello, o habeas nã| |Medio| |Politica|
249 |Irmãos Batista, decolagem autorizada Decisão do STF de homologar a delação premiada da JBS limpa a pista para Wesley e Joesley Batista venderem ativos no Brasil e viverem no Exterior.
O segundo fator, no caso da JBS, seria escapar da jurisdição brasileira, em investigações da Justiça Federal.
Em comunicado do dia 16 de junho, o grupo informou que fechou um acordo de confidencialidade com a holding dos irmãos Batista para avaliar o investimento.
Com base em uma cláusula da lei anticorrupção, a es| |Alto| |Corrupcao|
250 |Pedro Ladeira/FolhapressA PGR (Procuradoria-Geral da República) apresentou nesta sexta-feira (2) denúncia contra o senador afastado Aécio Neves (PSDB-MG) com base nas delações de executivos da JBS por corrupção passiva e obstrução de justiça.
No STF (Supremo Tribunal Federal), o relator do processo em que Aécio é investigado é o ministro Marco Aurélio Mello.
Operação da Polícia Federal derivada da delação da JBS levou à prisão um primo e a irmã de Aécio.
Frederico Medeiros, primo de Aécio, foi f| |Alto| |Corrupcao|
251 |A mesma indistinção por vezes ocorre entre a propriedade da empresa e a propriedade de seus acionistas controladores.
Todavia, o emprego das aeronaves não consta como benefício indireto -ou seja, Joesley faz uso da propriedade da empresa para fins absolutamente particulares e alheios aos interesses dos demais acionistas.
Noticiou-se que Joesley, após a divulgação do escandaloso acordo de delação premiada, mudou-se com sua família para os Estados Unidos em "seu jato", fato que, aliás, causou enor| |Alto| |Crime|
252 |O efeito pós-delação premiada dos donos da JBS toma um rumo que preocupa muito o campo: o do boicote de produtos.
Só a Seara, uma das empresas da JBS, tem 10 mil produtores integrados —são famílias de agricultores que criam animais para a empresa.
O grande avanço da safra se deve a um aumento da produtividade, uma vez que a área de cultivo teve expansão de apenas 3,7%.
"Turra reconhece, no entanto, que uma série de ações de ajustamento de conduta ética precisa ser feita.
Ao término da safra pass| |Alto| |Corrupcao|
254 |Com isso, caberá aos 11 ministros da Corte definir se Fachin continua como relator dos inquéritos ligados à colaboração de sete executivos da JBS no âmbito da Operação Lava Jato.
Como governadores não são processados no STF, Fachin enviou as informações ao Superior Tribunal de Justiça (STJ).
Segundo os delatores da JBS, Reinaldo Azambuja recebeu R$ 38 milhões.
Fachin é o relator da Lava Jato no STF e homologou as delações no mês passado.
são carlos e araraquaramogi das cruzes e suzanosão paulo e| |Medio| |Processo-Juridico|
255 |O bloqueio de ativos da JBS foi imposto como medida cautelar pelo magistrado.
SÃO PAULO – O banco UBS estima que a ação da JBS ( JBSS3 ) tem preço-alvo de R$ 11,80 em 12 meses, valor 96,3% acima do fechamento de terça-feira (20).
O juiz acrescentou que acrescentou que a venda pretendida também não foi autorizada pelo Cade (Conselho Administrativo de Defesa Econômica) até o momento.
Os executivos da JBS estimam que o programa de desinvestimento possa resultar em uma injeção de capital de cerca de| |Medio| |Processo-Juridico|
256 |Mas a taxa de retorno da JBS chega a 12,34%.
A correção da multa se fará apenas pelo IPCA, que está em 4,08% no acumulado de 12 meses.
Da Redação || 02/06/2017, 12h39 - ATUALIZADO EM 02/06/2017, 12h43Em pronunciamento na manhã desta sexta-feira (2) no Plenário do Senado, a senadora Ana Amélia (PP-RS) classificou como "um verdadeiro negócio da China" o acordo de leniência fechado pelo grupo JBS com o Ministério Público na terça-feira (30).
- Sinceramente, quando a multa é muito grande, eu desconfi| |Alto| |Processo-Juridico|
257 |+ PF conclui que Temer cometeu crime de obstrução de Justiça+ ‘Nada nos destruirá’, diz Temer ao afirmar que Brasil está na rota de superaçãoNewsletter Política Receba no seu e-mail conteúdo de qualidade Assinar E-mail cadastrado!
O procurador-geral da República, Rodrigo Janot, denunciou criminalmente nesta segunda-feira ao Supremo Tribunal Federal o presidente Michel Temer por corrupção passiva com base na delação dos acionistas e executivos do Grupo J&F, que controla a JBS.
Os pagamentos teria| |Alto| |Corrupcao|
258 |Diante dos argumentos citados acima, desafiamos a acusação para que aponte dados concretos sobre o recebimento do dinheiro para que tenhamos ampla possibilidade de defesa.
A defesa de Michel Temer desafiou nesta terça-feira, 27, o procurador-geral da República Rodrigo Janot, a apontar ‘dados concretos’ sobre o recebimento de R$ 500 mil em propinas da JBS para o presidente.
“Os dirigentes da JBS foram aconselhados a buscar eventuais provas para conseguir a aceitação da delação.”O defensor do pres| |Alto| |Processo-Juridico|
259 |Por Lucas Salomão, G1, BrasíliaPF diz que evidências indicam 'com vigor' que Temer praticou corrupçãoEm relatório entregue ao Supremo Tribunal Federal (STF), a Polícia Federal afirma que as evidências colhidas na investigação indicam "com vigor" que o presidente Michel Temer cometeu o crime de corrupção passiva.
"Com as minhas palavras: eu tenho certeza absoluta que nós tratamos propina com o Temer, nós nunca tratamos propina com o Rodrigo.
Joesley disse em depoimento que procurou o peemedebista| |Alto| |Corrupcao|
260 |O primeiro inquérito contra Aécio com base na delação da JBS levou à apresentação de denúncia contra o senador pela PGR (Procuradoria Geral da República) pelos crimes de corrupção e obstrução à Justiça.
O diálogo em que Aécio pede o dinheiro a Joesley foi gravado secretamente pelo empresário, que fechou acordo de colaboração premiada.
Este é o nono inquérito aberto contra Aécio no STF.
Ainda segundo Toron, a conversa entre Aécio e Joesley trata do oferecimento da compra de um imóvel da família d| |Alto| |Corrupcao|
261 |Trocou [Dilma por Temer], mas ocorreu tudo ao contrário.
A hipótese da fadiga também é utilizada pelo professor do Insper e cientista político Fernando Schuler, para quem existe "uma inconformidade passiva" com Michel Temer.
"Parte grande da população tinha a expectativa de que tudo melhoraria se trocasse o governo.
Segundo ele, os protestos contra Temer deveriam estar sendo efetivados pela oposição.
O pouco de energia que resta na esquerda é direcionada para tentar salvar Lula", destacou.| |Alto| |Manifestacao|
262 |O procurador-geral da República, Rodrigo Janot, reagiu ao pronunciamento do presidente Michel Temer nesta terça-feira (27/6).
Temer levantou a suspeita de que o procurador-geral da República, Rodrigo Janot, se beneficiou financeiramente da remuneração de Miller, mas negou, no entanto, que estivesse fazendo uma ilação.
Sobre o ex-procurador da República e hoje advogado Marcello Miller, a Procuradoria-Geral da República esclarece que ele não participou das negociações do acordo de colaboração prem| |Alto| |Processo-Juridico|
263 |O Ministério Público estuda se vai apresentar duas denúncias separadas, uma para cada crime, ou uma denúncia só.
“Lógico que esta perícia agora confirmando que não há nenhuma adulteração do áudio, como foi alegado pela defesa do senhor presidente da República, agrava, e agrava muito, a situação hoje posta com relação ao presidente da República”, diz Claudio Lamachia, presidente da OAB.
Foram analisadas as gravações da conversa de Joesley Batista com o presidente Michel Temer e também os gravador| |Alto| |Crime|
264 |O inquérito também investiga o ex-assessor de Temer Rodrigo Rocha Loures, que foi flagrado recebendo uma mala com R$ 500 mil de propina.
O Jornal Nacional não conseguiu contato com a defesa de Rodrigo Rocha Loures.
Segundo o relatório da Polícia Federal, enquanto resolvia a viagem por telefone, o então deputado Rocha Loures se dirigia para o Palácio do Planalto.
Apesar de ter viajado no avião da FAB, Rocha Loures fez questão de comprar uma passagem em um voo comercial.
Segundo o relatório da Pol| |Alto| |Corrupcao|
265 |Sempre que ele me chamava eu sabia que ele ia me pedir alguma coisa ou ele queria alguma informação.
Achava que era tentando me convencer de que não era para ele.
Eu mandava mensagem para ele, ele mandava para mim.
ÉPOCA – A delação da JBS revelou que a corrupção no Brasil é ainda mais ampla do que se sabia, mesmo após três anos de Lava Jato.
Mas eu queria entender se ele estava entendendo, se ele tinha alguma solução.| |Alto| |Corrupcao|
266 |A margem de erro é de dois pontos percentuais para mais ou para menos.
Aos irmãos Batista foi permitido que fossem para os Estados Unidos e pudessem manter o controle das empresas do grupo.
PublicidadeO acordo de colaboração premiada que a Procuradoria-Geral da República fechou com os donos da JBS, ao prever multa, mas não a prisão dos delatores, foi mal recebido por 64% da população, mostra pesquisa Datafolha.
Joesley Batista gravou secretamente uma conversa que travou com Temer tarde da noite | |Alto| |Crime|
267 |"Diante dos argumentos citados acima, desafiamos a acusação para que aponte dados concretos sobre o recebimento do dinheiro para que tenhamos ampla possibilidade de defesa", disse.
O advogado questiona também o fato de a acusação citar que Temer recebeu Joesley em horário noturno e fora da agenda.
27/06/2017 - 18h01 || Atualizado em 27/06/2017 - 19h00Advogado de Temer desafia MPF a apresentar "dados concretos" de recebimento de dinheiroBRASÍLIA - Em linha com a guerra declarada pelo presidente Mi| |Alto| |Politica|
268 |O advogado do presidente Michel Temer, Antônio Cláudio Mariz, afirmou que o presidente Michel Temer não cometeu crime de corrupção.
Mas posso adiantar que o presidente não cometeu o crime de corrupção que lhe foi imputado.
Sobre os aspectos fáticos da denúncia, eu só poderei me pronunciar depois”, disse Mariz à reportagem da Agência Brasil.
O advogado adiantou, entretanto, que o presidente é inocente das acusações de prática de corrupção.
A denúncia foi entregue ao STF hoje (26) e acusa Temer de| |Alto| |Manifestacao|
269 |Resultado do Golpe de 2016:deixar o País nas mãos do único presidente denunciado por corrupção.
"Resultado do golpe de 2016: deixar o país nas mãos do único presidente denunciado por corrupção",afirmou a petista na rede social.
Ainda segundo Dilma, o processo que levou à sua deposição ocorreu sem legitimidade.
O discurso de garantia da estabilidade econômica tem sido usado por aliados do presidente para defender que a Câmara barre eventual denúncia contra ele.
O que dizem as defesasO presidente | |Alto| |Manifestacao|
270 |Fachin vota por continuar à frente das investigações das delações da JBS Em julgamento no STF, relator da Operação Lava Jato também se manifestou contra a revisão dos benefícios concedidos a delatores da empresa JBS, que revelaram esquema de propina a políticos.
Ele foi citado por suposto recebimento de propina da JBS em troca de benefícios fiscais no Mato Grosso do Sul.
Para Janot, retirar de Fachin as delações da JBS e rever os benefícios negociados com os delatores seria um “salto triplo mort| |Alto| |Corrupcao|
271 |Willer Tomaz, advogado da JBS preso pela PF (Foto: Reprodução/ TV Mirante)Na mensagem aos integrantes da Procuradoria Geral da República (PGR), Rodrigo Janot afirmou que a prisão do procurador da República e do advogado foi embasada em robusta documentação.
MPF denuncia procurador e advogado da JBS por corrupção Ambos foram presos por suposto envolvimento com a operação Greenfield, que apura fraudes em fundos públicos de pensão e favorecimento a uma empresa de celulose controlada pelo conglomera| |Alto| |Crime|
272 |Enfim, o colaborador deve receber uma pena menor, mas esta não pode e não deve transformar o crime em um bom negócio.
Assim, as penas pelos delitos poderiam cair para algo em torno de 230 anos no mínimo e 1,3 mil anos no máximo.
O argumento é semelhante ao usado pela defesa dos Batista para justificar os termos do acordo de delação.
Um réu poderia praticar um crime, alavancar-se financeiramente e, depois, devolver o valor obtido com o delito.
A delação dos irmãos Joesley e Wesley Batista lhes va| |Alto| |Crime|
273 |Além dos R$ 500 mil vindos da OAS por meio de Temer, Alves também recebeu do então vice-presidente outros R$ 500 mil vindos da JBS.
A GloboNews teve acesso à cópia do cheque de R$ 500 mil depositado por Temer em favor do ex-deputado, dinheiro que saiu da OAS.
O cheque no valor de R$ 500 mil foi assinado em 10 de setembro de 2014 pela campanha de Temer.
O MPF afirma que R$ 500 mil saíram em propina para Alves.
O primeiro lugar em doações foi da JBS, do empresário Joesley Batista.| |Alto| |Corrupcao|
274 |Segundo o levantamento, apenas 7% dos entrevistados consideraram o governo Temer ótimo ou bom.
O volume financeiro ficou em R$ 5,740 bilhões.
Do lado negativo, entre as poucas quedas do dia, destaque para as ações da Embraer, que recuaram na esteira da forte queda do dólar comercial.
Na visão sócio da Leme Investimentos, o cenário político ainda bastante adverso limita o fechamento da curva de juros.
O dólar comercial recuou 1,13%, cotado a R$ 3,3015 na venda, ao passo que o contrato futuro do d| |Medio| |Economia|
275 |PGR denuncia Aécio Neves ao STF por corrupção passiva e obstrução de Justiça Também foram denunciados, mas somente por corrupção passiva, a irmã e o primo do senador do PSDB-MG, e um ex-assessor do senador Zeze Perrella (PMDB-MG).
A denúncia contra Aécio Neves será analisada pelo relator do caso, ministro Marco Aurélio Mello, que vai notificar os acusados a apresentarem defesa.
No diálogo, Aécio pede ao empresário R$ 2 milhões a fim de pagar um advogado para defendê-lo na Operação Lava Jato.
Por| |Alto| |Corrupcao|
276 |Eles serão julgados pela primeira instância da Justiça Federal em São Paulo, localidade onde foram promovidas ações controladas da Polícia Federal a partir das delações da JBS.
"A defesa do Senador Aécio Neves recebe a informação com naturalidade por se tratar de desdobramento da denúncia inicial.
Segundo a Procuradoria-Geral da República, será investigado suposto pagamento de mais de R$ 60 milhões em propina, por meio de notas fiscais frias da JBS.
O dono da JBS, Joesley Batista, gravou escondi| |Alto| |Processo-Juridico|
277 |SÃO PAULO - A Eletrobras informou que sua subsidiária Eletrosul e a Shanghai Electric Power Transmission and Distribution Engineering, pertencente à empresa chinesa Shanghai Electric, assinaram acordo preliminar para a transferência de projetos de transmissão de energia no Rio Grande do Sul.
Os empreendimentos compõem o Lote A, arrematado pela Eletrosul no leilão 04/2014, promovido pela Agência Nacional de Energia Elétrica (Aneel).
A Shanghai Electric deve constituir uma sociedade de propósito e| |Baixo| |Positiva|
278 |A Agência Nacional de Energia Elétrica (Aneel) aprovou reajuste de 74,74% nas tarifas recebidas por nove transmissoras de energia para o ciclo 2017/2018.
) dizem respeito às indenizações; 3,23 p.p., ao reajuste previsto em contrato; e 2,32 p.p., aos investimentos mais recentes na expansão da rede.
Uma ação judicial de associações de grandes indústrias questiona a parcela de remuneração sobre esses valores, que não estava prevista na MP 579/2012.
Ao calcular a receita das transmissoras, a Aneel c| |Baixo| |Positiva|
279 |Tentei tudo que podia, o que era possível, mas no fundo era um condomínio enorme.
Quando se fala que uma estatal pertence ao povo, não é verdade, percente aos políticos e aos grupos de interesse ali organizados", disse.
Ele contou que, durante seu governo, só foi possível privatizar uma parte da Eletrosul, e não o restante das empresas do grupo.
"Nosso sistema político está tudo podre, deu cupim nele, bichou.
"Eu lamento dizer, mas, dada a experiência, o que puder privatizar privatiza, não tem m| |Medio| |Manifestacao|
280 |De Wilson Ferreira Júnior, presidente da Eletrobras, em reunião com sindicalistas no último dia 1º (o áudio foi divulgado pelo Estadão), sobre os "chefes" da estatal:"São 40% da Eletrobras.
A sociedade não pode pagar por vagabundo, em particular, no serviço público.
40% de cara que é inútil, não serve para nada, ganhando uma gratificação, um telefone, uma vaga de garagem, uma secretária.
