SÃO PAULO (Reuters) - A Petrobras voltará a atuar em energias renováveis após fase de transição para resolver altíssimo endividamento, disse nesta terça-feira o presidente da estatal, Pedro Parente , durante o Ethanol Summit, promovido pela União da Indústria de Cana-de-Açúcar (Unica), em São Paulo.
A afirmação foi feita após a Petrobras ter vendido important| |Baixo| |Positiva|
140 |Além da disparada da commodity, os papéis da mineradora foram influenciados pela aprovação dos acionistas do plano de reestruturação da empresa.
O volume financeiro movimentado com o papel ficou em R$ 1,2 milhão, contra média diária de R$ 707,4 mil dos últimos 21 dias.
Em meio ao rumor, as ações da companhia fecharam na máxima do dia, com alta de 22%.
O desdobramento terá como base a posição acionária desta segunda-feira, com os papéis passando a negociar na forma "ex" a partir desta terça-feira| |Baixo| |Positiva|
141 |Órgão do Ministério de Energia sugere que Petrobras corte volume de gás comprado na Bolívia Contrato com a Bolívia vence em 2019; mudanças na renovação do acordo abririam espaço para novos importadores.
O contrato de importação da Petrobras com empresa da Bolívia vence em 2019.
A Bolívia iniciou o fornecimento de gás natural ao Brasil em 1999, através do Gasoduto Bolívia-Brasil (Gasbol).
"É razoável supor que ocorra a renovação do contrato de fornecimento firme de 16 milhões de m³/dia por parte | |Baixo| |Positiva|
142 |Presidente da Petrobras, Pedro Parente.
Pedro Parente lembrou que a Petrobras ganhou dois degraus nas notas pela agência Moody’s, e uma nota pela Standard & Poors, recentemente.
Mas no início o Fipe Sondas(controlador da Sete) não queria participar.
Na saída do evento, Pedro Parente reafirmou a decisão da Petrobras de reiniciar as negociações com a Sete Brasil em relação às encomendas de sondas de perfuração.
Foto: Edilson Dantas / Agência O GloboRIO - O presidente da Petrobras, Pedro Parente, d| |Baixo| |Positiva|
143 |Na noite de 11 de junho, a mesma plataforma sofreu um princípio de incêndio, levando à paralisação da produção por um curto período.
Marlim está entre os seis principais campos produtores de petróleo da Petrobras e é um dos mais antigos do país.
A sonda trabalhava a serviço da Petrobras.
É a segunda vez em duas semanas que a empresa precisa interromper a produção da P-35 para garantir a segurança da unidade.
Disse ainda que não houve feridos, e que a plataforma encontra-se em condição segura.| |Alto| |Dano-Ambiental|
145 |A denúncia acusou Duque de receber uma parte da propina destinada à Diretoria de Serviços e Engenharia da Petrobrás (Consórcio Interpar, Consórcio CMMS, Consórcio Gasam e contrato do Gasoduto Pilar Ipojuca).
Lava JatoPena do ex-diretor de Serviços da Petrobrás Renato Duque mais do que dobrou com condenação por corrupção na Lava JatoDuque foi acusado de receber proprinaFoto: Agência BrasilEstadão ConteúdoNa mesma decisão que absolveu o ex-tesoureiro do PT João Vaccari Neto, o Tribunal Regional Fe| |Alto| |Corrupcao|
146 |"À RBA, Rangel afirmou que a greve da próxima sexta-feira "tem um caráter fundamental, pelo desmonte que a nossa empresa vem sofrendo".
Os petroleiros denunciam também a extinção de postos de trabalho nas refinarias, que passaram a operar abaixo do contingente mínimo sugerido, aumentando o risco de acidentes.
"Visa a atender interesses das petrolíferas internacionais, interessadas na venda de ativos da empresa.
Ele ressaltou que os petroleiros têm "obrigação" de resistir a esse processo.
E denun| |Medio| |Manifestacao|
148 |A Âmbar afirmou ter total desconhecimento da pressão feita por "executivos da J&F" junto ao Cade para que o negócio com a Petrobras fosse resolvido.
A Petrobras informou que, nas reuniões iniciais ocorridas no Cade, apresentou documentos mostrando que o pedido da Âmbar era impraticável.
Em abril de 2016, a superintendência acatou as reclamações da Âmbar e abriu um inquérito administrativo contra a Petrobras.
O acordo só saiu depois, quando a Âmbar aceitou as condições da Petrobras, e não o contr| |Medio| |Manifestacao|
149 |PublicidadeA diretoria da Petrobras autorizou a retomada de negociações com a empresa de sondas Sete Brasil, hoje em recuperação judicial.
Desde então, vem tentando negociar um plano de recuperação com seus credores.
A ideia é ouvir o que a direção da Sete tem a propor.
O contrato inicial previa a contratação de 29 sondas, que seriam usadas para explorar reservas no pré-sal.
A Sete pediu recuperação judicial em abril de 2016, com uma dívida de R$ 19,3 bilhões.| |Medio| |Processo-Juridico|
150 |O presidente da Petrobras, Pedro Parente, dá entrevista a jornalistas após participar de evento com investidores em São Paulo (Foto: Karina Trevizan/G1)A abertura de capital da BR depende de aprovação do conselho da Petrobras.
Por Karina Trevizan, G1A Petrobras vai propor ao conselho de administração que avalie a abertura de capital da BR Distribuidora.
Petrobras avalia abrir capital da BR Distribuidora, diz Pedro Parente Presidente da estatal disse que vai propor ao conselho de administração a | |Baixo| |Positiva|
151 |Segundo a área técnica, a falha no documento já seria suficiente para desconstituir a política de hedge da empresa.
Desde 2013 a Petrobras adota a contabilidade de hedge com justificativa de proteger exportações futuras projetadas dos efeitos da variação cambial com uso da dívida líquida dolarizada.
No caso da Petrobras, havia dívidas com vencimento em 2027, embora sua estratégia de gerenciamento de riscos mencionasse a proteção de exportações por sete anos (até 2020).
Rio – No que depender das | |Baixo| |Positiva|
152 |Cunha, que na ação é acusado de receber propina justamente por ter indicado Zelada à Diretoria Internacional da estatal, defende-se jogando a responsabilidade para o antigo aliado.
Um dos pedidos é que seja reconhecido cerceamento de defesa por Moro ter indeferido 21 das 41 perguntas encaminhadas a Temer.
A defesa também pede a absolvição de Cunha ao apontar que os recursos transferidos pelo lobista João Henriques para a conta do ex-parlamentar na Suíça não poderiam ser considerados propina.
Os | |Alto| |Corrupcao|
153 |Plataforma de petróleoDivulgação/PetrobrasA Petrobras pretende instalar quatro novas plataformas na Bacia de Campos nos próximos anos.
Esse volume representa 64% da produção total da companhia do Brasil.
O projeto de revitalização de Marlim é uma das apostas da Petrobras para reduzir o declínio natural da produção na Bacia de Campos, de acordo com o gerente.
O declínio estável da área está em torno de 9%, enquanto a média mundial está em 12%.
A primeira será o FPSO Cidade de Campos de Goytacazes| |Baixo| |Positiva|
154 |Em relação a maio do ano passado, a Petrobras registrou aumento de 37% na produção da camada do pré-sal, segundo comunicado.
GásA produção de gás natural da Petrobras no Brasil, excluído o volume liquefeito, atingiu 78,9 milhões de metros cúbicos por dia em maio, 0,5% acima do mês anterior.
Já a produção de gás natural fora do Brasil foi de 9,3 milhões de metros cúbicos, queda de 3% na comparação com abril deste ano, em consequência da menor demanda da produção de gás na Bolívia.
Pré-salA produç| |Baixo| |Positiva|
155 |As obras de construção da carteira de enxofre da Refinaria Abreu e Lima, em Pernambuco, serão retomadas nas próximas semanas.
A Petrobras assinou contrato com o Consórcio Conenge SC/ Possebon para a conclusão da Unidade de Tratamento de Águas Ácidas (UTAA) e da Unidade de Tratamento com Metildietanolamina (MDEA), e suas interligações.
Desde o início da operação em 2014, o Trem 1 tem a carga de 100 mil bpd.
A Refinaria Abreu e Lima, localizada em Ipojuca, no Complexo Industrial Portuário de Suape| |Baixo| |Positiva|
156 |A venda da participação da Petrobras no Campo do Azulão, na Bacia do Amazonas, entrou na fase vinculante, quando a estatal envia cartas convite aos potenciais compradores habilitados na fase anterior.
De acordo com a Petrobras, a nova etapa da venda atende às determinações e orientações do Tribunal de Contas da União (TCU) para os desinvestimentos da empresa.
Petrobras deu início a fase vinculante para a cessão de sua participação no Campo do Azulão, na Bacia do Amazonas, dando continuidade ao F| |Medio| |Dano-Ambiental|
157 |LEIA MAIS: Petrobras aprova acordo para encerrar ação nos EUAA suspensão da ação coletiva foi decidida pela Corte de Apelação após recursos da estatal.
Somente essa ação coletiva, que tramita desde 2014, reivindica um ressarcimento de até US$ 10 bilhões da Petrobras.
Prédio da Petrobras: ação coletiva contra a estatal está suspensa - Guilherme Leporace / Guilherme Leporace/5-4-2016RIO - A Petrobras está concentrando esforços nas negociações para fechar acordos com sete investidores que entraram | |Baixo| |Positiva|
158 |Cunha, que na ação é acusado de receber propina justamente por ter indicado Zelada à Diretoria Internacional da estatal, defende-se jogando a responsabilidade para o antigo aliado.
Um dos pedidos é que seja reconhecido cerceamento de defesa por Moro ter indeferido 21 das 41 perguntas encaminhadas a Temer.
A defesa também pede a absolvição de Cunha ao apontar que os recursos transferidos pelo lobista João Henriques para a conta do ex-parlamentar na Suíça não poderiam ser considerados propina.
Os | |Alto| |Corrupcao|
159 |[]O ex-ministro Antonio Palocci foi condenado nesta segunda-feira a 12 anos e dois meses de prisão por corrupção passiva e lavagem de dinheiro no escândalo da Petrobras.
Mas foi forçado a renunciar em 2006 após se ver envolvido em um escândalo de violação do segredo bancário.
A Constituição estabelece que, quando um presidente é denunciado, dois terços dos deputados devem validar essa denúncia para que o Supremo Tribunal Federal (STF) o processe.
A Justiça também mira o presidente Michel Temer q| |Alto| |Corrupcao|
160 |O recurso foi julgado nesta terça-feira (27) pela 8ª Turma do tribunal, responsável pelos processos de segunda instância da Operação Lava Jato.
Ex-diretor da Petrobras foi condenado por corrupção, lavagem de dinheiro e associação criminosa.
Hoje a defesa considera que conseguiu o reconhecimento da desproporcionalidade que havia na condenação de Sônia Branco em relação aos demais acusados.
O advogado Antônio Figueiredo Basto, responsável pela defesa de Renato Duque, disse que vai aguardar a publi| |Alto| |Corrupcao|
161 |O Estado apurou que um dos operadores da empresa norueguesa estabeleceu uma “parceria” com Zelada, ex-diretor da Área Internacional da Petrobrás.
A apuração envolve o ex-diretor da estatal brasileira Jorge Zelada, ligado ao PMDB, partido de Temer.
Integrantes da força-tarefa da Lava Jato em Curitiba e promotores paulistas também estarão no encontro.
Ele seria da cota do PMDB dentro da estatal e homem de confiança do deputado cassado Eduardo Cunha (PMDB-RJ).
A defesa do ex-diretor da Petrobrás af| |Alto| |Corrupcao|
162 |Petrobras considera ‘seriamente’ aumentar a frequência de reajuste da gasolina, diz Parente Presidente da estatal voltou a dizer que a periodicidade mensal da política de preços pode não ser suficiente para acompanhar variações do câmbio e do preço do petróleo.
Foi o que afirmou nesta quinta-feira (22) o presidente da estatal, Pedro Parente, em evento com investidores em São Paulo.
Esta não foi a primeira vez que Parente afirmou que a Petrobras pode aumentar a periodicidade dos anúncios de alter| |Medio| |Economia|
163 |“Não é invenção de um partido político.”(Reportagem de Ricardo Brito e Maria Carolina Marcello)
Reuters Tamanho do textoBRASÍLIA (Reuters) - O relator do processo da chapa Dilma-Temer no Tribunal Superior Eleitoral (TSE), Herman Benjamin, afirmou nesta quinta-feira que os depoimentos e informações colhidas no processo apontam que os casos de corrupção na Petrobras existem desde o início da empresa.
No processo, o partido alega que houve abuso de poder político e econômico, o que incluiria o fina| |Alto| |Processo-Juridico|
164 |“Todos os fatos relatados na colaboração com a Justiça por executivos da J&F se dão no âmbito da holding, e não da Âmbar.
A Petrobras anunciou na manhã desta quinta-feira a suspensão de um contrato de fornecimento de gás com a empresa Âmbar por causa de corrupção.
A companhia atua no setor de energia e é parte do grupo J&F, que também controla o frigorífico JBS.
A Petrobras disse que vai pedir 70 milhões de reais de indenização por causa da quebra desse contrato, que iria até o fim deste ano.
A | |Alto| |Corrupcao|
165 |Trecho do depoimento de LulaTrecho de depoimento de Lula, em maioACUSAÇÃO X DEFESA - Os argumentos do Ministério Público Federal e do ex-presidente Lula
Os autos do caso já estão com Moro para a sentença.
Pinheiro afirmou ainda que Lula pediu a destruição de provas.
Para incriminá-lo, a acusação cita, por exemplo, trechos que classifica contradições, como a explicação de Lula para um encontro com o ex-diretor da Petrobras Renato Duque, em 2014.
A Procuradoria pede que Moro determine o regime fec| |Alto| |Processo-Juridico|
166 |O anúncio da Petrobrás, por outro lado, ajuda a explicar a lhaneza semiótica com que a Globo trata tanto os dilemas do PSDB, quanto a sordidez sem fim do governo Temer.
Diriam, por exemplo, que a permanência do PSDB no governo Temer demonstra cumplicidade do partido com a roubalheira e com a corrupção.
É um tanto curiosa a maneira extremamente delicada com a qual a imprensa trata os difíceis “dilemas” do PSDB.
Nenhum dos adversários ou críticos do PSDB jamais ganham qualquer espaço para fazer co| |Alto| |Corrupcao|
167 |A auditoria independente KMPG Internacional informou ao juiz da Lava-Jato, Sérgio Moro, que não foram encontrados indícios de corrupação envolvendo o ex-presidente Lula na Petrobras.
Ex-presidente Lula durante Congresso Nacional do PT Foto: Filipe AraЩjo/Fotos PЩblicasA auditoria independente KMPG Internacional informou ao juiz da Lava-Jato, Sérgio Moro, que não foram encontrados indícios de corrupação envolvendo o ex-presidente Lula na Petrobras.
Outra auditoria já havia entregue um parecer afi| |Medio| |Processo-Juridico|
168 |Em novembro de 2015, Vaccari foi condenado por Moro a 15 anos e quatro meses de prisão pelos crimes de corrupção passiva, lavagem de dinheiro e associação criminosa.
Ao contrário de Sergio Moro, os desembargadores consideraram os crimes de corrupção separadamente e somaram as condenações em cada um deles.
Com a revisão da punição a Duque, ele soma condenações que chegam a 86 anos e dez dias de prisão.
Apesar da absolvição no TRF4, Vaccari tem condenações em outros quatro processos em primeira in| |Alto| |Crime|
169 |Reforçou que seus contatos com Lula seguiram sempre o padrão que manteve com Fernando Henrique Cardoso e com os demais ex-presidentes da República.
Esse depoimento reforça os testemunhos já coletados no dia 5/6, ocasião em que o próprio Emílio e outros executivos do grupo reconheceram que Lula jamais teve a posse ou a propriedade desse imóvel.
Para o advogado de Lula na ação, Cristiano Zanin Martins, o depoimento de Fábio Barbosa desmonta a tese do Ministério Público Federal, de que havia um esq| |Medio| |Processo-Juridico|
170 |Para o Departamento de Justiça, a cooperação internacional é um “desafio” nesse caso, não apenas para o Brasil, mas também para os suíços.
Para os suíços, a cooperação internacional foi “crucial” para atingir progresso nos processos em ambos os países.
O governo suíço, apesar de estar acostumado com dezenas de escândalos de corrupção, reconhece que a dimensão da corrupção no Brasil sai dos padrões.
Com um terço da fortuna global depositados em seus bancos, as autoridades suíças adotam tradiciona| |Alto| |Corrupcao|
172 |Rodrigo Janot deve apresentar novas denúncias contra o presidente.
CorreçãoNa reportagem que foi ao ar o JN informou que o dono da Rodrimar disse ter uma relação de amizade com o presidente Temer.
Celso foi identificado como Antônio Celso Grecco, sócio e presidente da Rodrimar.
Na verdade, a assessoria da empresa declarou que os dois não têm qualquer relação de amizade.
A assessoria da Rodrimar declarou que o dono da empresa não tem relação de amizade com o presidente Temer e negou qualquer paga| |Medio| |Processo-Juridico|
173 |Reuters Tamanho do textoSÃO PAULO (Reuters) - A Petrobras notificou a Âmbar, empresa de energia da holding J&F, controladora da empresa de alimentos JBS, da extinção antecipada de contrato de fornecimento de gás para uma termelétrica em Cuiabá devido à violação de cláusula contratual que trata de legislação anticorrupção, segundo comunicado da estatal nesta quinta-feira.
"A Petrobras também exercerá a prerrogativa de cobrança de indenização pelo descumprimento das cláusulas contratuais da ordem | |Alto| |Corrupcao|
174 |A gente percebia claramente que ele ostentava para se creditar como interlocutor da então presidente da República”, disse ex-presidente da Petrobras Aldemir Bendine.
O juiz Sérgio Moro autorizou a abertura de inquérito para investigar o ex-presidente da Petrobras Aldemir Bendine, por suspeita de corrupção e lavagem de dinheiro.
Aldemir Bendine foi presidente do Banco do Brasil por quase seis anos e assumiu a presidência da Petrobras, em 2015, por indicação da ex-presidente Dilma Rousseff.
Aldemi| |Alto| |Processo-Juridico|
175 |Inquirido pela defesa sobre a existência de fraude sistêmica, Peixoto Neto foi claro: "Não identificamos nada materialmente importante".
Registrou inclusive que o valor da proposta vencedora ficou abaixo da estimativa da Petrobras, no caso da licitação da Comperj, e também aquém da margem praticada pela petrolífera.
Os relatórios eram apresentados trimestralmente ao Comitê de Auditoria da petrolífera e anualmente ao Conselho de Administração.
Houve ainda depoimentos de um sócio da Ernest & Young| |Alto| |Crime|
176 |Por G1 PR, CuritibaO juiz federal Sérgio Moro decidiu nesta terça-feira (13) receber uma denúncia contra três ex-gerentes da Petrobras e três empresários.
Os ex-gerentes da estatal forneciam informações privilegiadas para as empresas indicadas pelos intermediários vencerem as licitações da área de Gás e Energia da Petrobras.
As investigações contra o grupo levaram à deflagração da 40ª fase da Operação Lava Jato.
Segundo a denúncia do Ministério Público Federal (MPF), houve pagamento de R$ 150 mi| |Baixo| |Positiva|
177 |A ação é relacionada ao ex-ministro da Fazenda Antonio Palocci, cuja sentença foi proferida por Moro nesta segunda-feira.
Santana e Mônica já haviam sido condenados por Moro em fevereiro deste ano pelos crimes de lavagem de dinheiro em outro esquema de corrupção na Petrobras, a oito anos e quatro meses de prisão por lavagem de dinheiro.
Santana e Monica foram presos em fevereiro de 2016, alvo da Operação Acarajé, na 23ª fase da Lava-Jato.
Mesmo com o acordo de delação premiada, Moro considerou q| |Alto| |Corrupcao|
178 |Durante a conversa, Maia também demonstrou que quer cancelar o recesso parlamentar, que ocorre na segunda quinzena de julho, para apreciação da denúncia com celeridade.
Molon considera que o rito deve ser igual porque não pode depender do grau de apoio ao presidente da República por parte do presidente da Câmara.
A oposição também pede que o procurador-geral da República, Rodrigo Janot, seja ouvido no dia da votação para sustentar a denúncia, que o presidente da Casa repita o nome dos parlamenta| |Medio| |Positiva|
179 |"Resultado do Golpe de 2016: deixar o País nas mãos do único presidente denunciado por corrupção", escreveu Dilma no twitter e no Facebook.
27/6/2017 às 14h55Ex-presidente comentou denúncia contra Temer nas redes sociaisAlvo de impeachment, Dilma ironizou denúncia contra Temer Ueslei Marcelino/ReutersA ex-presidente Dilma Rousseff utilizou as redes sociais para comentar a denúncia do procurador-geral Rodrigo Janot contra o presidente Michel Temer.
Fontes adiantaram à reportagem que ele vai se pr| |Medio| |Processo-Juridico|
180 |Pela primeira vez, um presidente da República foi acusado formalmente de crime comum no exercício do cargo.
O quadro seria diferente se fosse um crime de responsabilidade, passível de perda de mandato e inelegibilidade, que é julgado pelo Senado.
Dilma Rousseff, que também foi alvo de processo de impeachment, não foi denunciada por crime comum enquanto era presidente.
SÃO PAULO, SP (FOLHAPRESS) - A denúncia da Procuradoria-Geral da República contra Michel Temer, apresentada nesta segunda (26), c| |Medio| |Processo-Juridico|
181 |A notícia de que o procurador-geral da República, Rodrigo Janot, denunciou ao STF (Supremo Tribunal Federal) o presidente da República repercute na imprensa internacional.
"O britânico The Guardian diz em sua manchete que "O presidente do Brasil, Michel Temer, foi acusado de corrupção".
O britânico Financial Times noticiou os acontecimentos políticos no Brasil com uma chamada na página principal.
O noticiário aponta que Rodrigo Janot submeteu a acusação à Suprema Corte, dizendo que Temer "engano| |Medio| |Politica|
182 |"Em outras palavras, crimes não são cometidos no céu e, em muitos casos, as únicas pessoas que podem servir como testemunhas são igualmente criminosos.
A fase da Lava Jato em que Palocci foi preso foi batizada justamente como "Omertà".
O magistrado também defende os decretos de prisões temporárias e preventivas, principalmente devido aos riscos de que os alvos continuem cometendo irregularidades, "dados os indícios de atividade criminal grave reiterada, habitual e profissional.
De qualquer forma| |Alto| |Crime|
183 |— Não se substitui um presidente da República a toda hora, ainda que se queira — enfatizou Gilmar no voto, que trouxe um duro discurso em favor da proteção dos mandatos.
A favor da cassação da chapa, Luiz Fux lembrou que muitas das informações do processo foram apresentadas por "testemunhas" e não por "delatores".
Segundo ministro a se manifestar, Napoleão abriu a divergência, votando pela absolvição da chapa.
Eu não teria a paz necessária que deve ter um magistrado se eu não enfrentasse esses f| |Medio| |Politica|
185 |Dilma também aproveitou para criticar os grupos que apoiaram sua saída da presidência da República no ano passado, com destaque para a "grande mídia" e o principal partido da oposição naquele momento, o PSDB.
Eis a sequência de postagens feitas pela ex-presidente:
SÃO PAULO - A ex-presidente Dilma Rousseff fez uso de sua conta no microblog Twitter para criticar o processo de impeachment , concluído há pouco menos de um ano, e seu sucessor Michel Temer após a apresentação de denúncia contra o pee| |Medio| |Politica|
186 |Após o fim dos trabalhos da CCJ, Maia deverá submeter a denúncia para votação entre os 513 deputados da Câmara, que deverão autorizar se a denúncia pode prosseguir.
Também se abre uma oportunidade para que Temer apresente uma defesa prévia.
Mas isso também depende do Supremo Tribunal Federal (STF), já que cabe à Corte enviar a denúncia para análise pela Câmara.
Para que a denúncia seja aceita, são necessários os votos de, pelo menos, 342 deputados, ou 2/3 da Câmara.
De acordo com o calendário da| |Alto| |Processo-Juridico|
187 |Com 621 votos, Dino vai compor uma lista tríplice ao lado dos subprocuradores-gerais Raquel Dodge, que teve 587 votos, e Mario Bonsaglia, que recebeu 564 votos.
Mas que, com Dino em primeiro, o presidente poderá optar por Raquel, que faz oposição a Janot.
Temer já disse a assessores e auxiliares que não nomeará o primeiro da lista tríplice.
Em conversas reservadas, no entanto, o presidente disse que escolherá um nome da lista.
Dino é visto como o nome mais próximo do atual procurador-geral, Rodr| |Baixo| |Politica|
188 |Eram apenas duas mulheres ao lado de Temer: além de Muniz, estava a deputada Elcione Barbalho (PMDB-PA).
Ao vê-la, Temer disse: "agora sim uma companhia feminina", antes de saudar os demais aliados, convocados pelo Planalto para aparecer ao lado dele no pronunciamento.
No ano passado, Ruy Muniz tentou se reeleger à prefeitura de Montes Claros, mas perdeu a disputa para Humberto Souto (PPS-MG).
A deputada Raquel Muniz foi um dos aliados presentes e se posicionou ao lado esquerdo do peemedebista.
| |Baixo| |Positiva|
189 |Na ocasião, Temer afirmou: "Não sei como Deus me colocou aqui".
No vídeo está a explicação: "Foi Golpe".
No vídeo aparece uma gravação entre o ex-presidente da Transpetro Sérgio Machado e o senador Romero Jucá (PMDB-RR) falando sobre um "grande acordo nacional" para colocar temer no Poder, que envolveria até mesmo o Supremo Tribunal Federal (STF), segundo palavras do senador peemedebista.
247 - O deputado Paulo Pimenta (PT-RS) rebateu, por meio de um vídeo publicado nas redes sociais, a afirmaçã| |Alto| |Corrupcao|
190 |Eu acho que isso que dá sensação de que toda essa articulação saiu vitoriosa.
E (a delação da JBS) dá uma sensação de que o crime compensou, pois formou essa articulação vitoriosa.
Eu acho que, mesmo que o Temer saia combalido, o termo Sarneyrização, que tem sido usado, não se aplica.
São os antirreformistas com os jacobinos.
Um dos empresários que capitanearam o movimento em defesa do impeachment de Dilma Rousseff, no ano passado, o presidente da Riachuelo, Flávio Rocha, afirma que a delação da| |Medio| |Politica|
