"O PL 004/2017 é mais um ataque que o governo Nelson Ma| |Medio| |Politica|
375 |Eu me sinto preparado e motivado para liderar a Tractebel nesta nova fase da companhia”, afirmou Sattamini.
Diante disso, a Tractebel Energia está acompanhando e se antecipando a estas mudanças.
A geradora Tractebel Energia terá como novo diretor presidente o atual diretor financeiro e de relações com investidores, Eduardo Sattamini (foto), que foi eleito por unanimidade de acordo com ata de reunião do Conselho de Administração divulgada na terça-feira (31).
Sattamini, que acumulará os cargos at| |Alto| |Politica|
376 |Segundo o diretor-presidente da Engie Brasil Energia, Eduardo Sattamini, o empreendimento marca a entrada definitiva do grupo no setor de geração solar centralizada no Brasil.
O complexo de Assu é o primeiro do tipo solar fotovoltaico de porte comercial da Engie no país, onde já desenvolveu um projeto piloto da mesma tecnologia em Tubarão (SC).
RIO - A Engie Brasil Energia (antiga Tractebel Energia) recebeu na última semana a licença de instalação, pelo Instituto de Desenvolvimento Sustentável e| |Baixo| |Positiva|
377 |A própria Tractebel tem ativos que foram colocados à venda –são duas usinas eólicas e uma pequena hidrelétrica que somam pouco mais de 60 megawatts em capacidade instalada.
Não vamos tomar nenhum tipo de atitude que nos previna de depois entrar em um ativo melhor.
“Tem muita coisa que está acontecendo no mercado… Um excesso de oferta de ativos.
O diretor também comentou que os leilões de energia neste ano deverão ser menos atrativos para os geradores, em função da recessão, que tem deixado as di| |Medio| |Economia|
378 |O carioca Eduardo Sattamini, 51 anos, lidera desde o início do mês nova fase da Engie Tractebel Energia, maior geradora privada do Brasil.
Como está o projeto de um terminal de gás natural liquefeito da Engie Tractebel na região do Porto de Imbituba?
Quando será feita a transferência da parte da usina Jirau, que pertence ao grupo Engie Brasil, para a Engie Tractebel?
E a ENGIE Tractebel Energia também vai se adaptar a essa nova realidade.
A ENGIE Tractebel Energia já orienta suas decisões de inv| |Medio| |Economia|
379 |Almirante, indicado pela Engie, atuava até o início de 2016 pela TrustEnergy, responsável pela gestão executiva da Engie Europa em Portugal, segundo a empresa.
A mudança de nome da empresa será analisada em assembleia extraordinária convocada para 14 de julho.
A geradora Tractebel Energia, controlada pela francesa Engie, apresentará a seus acionistas proposta para que a empresa passe a se chamar Engie Brasil Energia, informou a companhia em comunicado ao mercado nesta terça| |Baixo| |Positiva|
380 |“Ele fazia girar uma turbina, que acionava um gerador de energia, produzindo eletricidade”, explica Segen Estefen, coordenador do projeto, da Coppe.
Calcula-se que em 15 ou 20 anos essa opção energética já terá adquirido uma relevância considerável.
“Estamos pondo o Brasil entre os países que buscam o domínio das tecnologias de aproveitamento dessa fonte de energia para gerar eletricidade em grande escala”, explica.
Ela será transmitida por um cabo, que descerá ao fundo do mar pelas colunas e da| |Baixo| |Positiva|
381 |O presidente da ENGIE Brasil e do Conselho de Administração da ENGIE Tractebel Energia, Maurício Bähr, deu posse hoje ao economista Eduardo Sattamini, como diretor presidente da maior geradora privada do Brasil, e ao novo Diretor de Geração da Companhia, José Laydner.
Desejo esse mesmo sentimento aos que estão me sucedendo, pois aqui vivi importantes anos da minha vida pessoal e profissional”, finalizou.
A solenidade, no auditório da sede Empresa, em Florianópolis, foi transmitida via videoconfe| |Baixo| |Positiva|
382 |A companhia fechou o período com uma dívida líquida de 1,22 bilhão de reais, ante 1,075 bilhão no fim de março de 2016.
Rio de Janeiro – A geradora de energia elétrica Engie Brasil Energia fechou o primeiro trimestre com lucro líquido de 450,7 milhões de reais, alta de 29,8 por cento ante mesmo período do ano passado, informou a companhia nesta terça-feira.
Já as vendas de energia da Engie Brasil, anteriormente conhecida como Tractebel, tiveram queda de 0,9 por cento no período em comparação com| |Baixo| |Economia|
384 |Foi Renan quem disse, líder do partido de Temer, 14 vezes investigado pelo Supremo Tribunal Federal como suspeito por vários crimes.
* Temer não tem mais a confiança da sociedade para fazer uma reforma como essa [a trabalhista] na calada da noite.
* Temer errou ao achar que poderia governar o Brasil influenciado por um presidiário de Curitiba [Eduardo Cunha].
* Demorar mais um mês, dois meses, um ano a frente do governo não vai mudar nada.
É uma resistência para o nada.| |Alto| |Manifestacao|
388 |No primeiro ano do governo de Dilma, em 2011, a pasta tinha um orçamento de R$ 651,4 milhões.
Marina critica política ambiental de Dilma e Temer, mas omite falhas de sua gestãoPor Bárbara LibórioEm entrevista ao site Poder360, Marina Silva, líder do partido Rede Sustentabilidade, teceu críticas ao que chamou de retrocessos ambientais dos governos da ex-presidente Dilma Rousseff (PT) e do atual presidente Michel Temer (PMDB).
Uma das maiores polêmicas da agenda ambiental do governo Dilma Rousseff| |Baixo| |Positiva|
389 |A área foi sendo desmatada como forma de criar o fato consumado que levasse à mudança dos limites da Floresta.
Nesses meses da tramitação, aumentou a pressão da grilagem na área que mostra o que o país não tem sido capaz de fazer em favor da proteção.
Ao vetar a MP que ele mesmo propôs, reduzindo a área de proteção da floresta, não foram anulados os efeitos que a medida provocou.
É que para fazer de conta que não estava diminuindo Floresta Nacional, o governo ampliou outra área, o Parque Naciona| |Alto| |Dano-Ambiental|
390 |ex-presidente Luiz Inácio Lula da Silva (PT) lidera as intenções de voto para a disputa do executivo nas eleições de 2018, segundo uma pesquisa feita pelo Instituto Datafolha.
Atualmente possui 15% das intenções de voto, tanto com a candidatura de Alckmin quanto de Dória, disputando com Bolsonaro o segundo lugar.
Jair Bolsonaro cresceu 10% em relação à pesquisa realizada em dezembro de 2015, atingindo 16% em uma simulação incluindo Geraldo Alckm| |Baixo| |Eleicoes|
391 |E aqueles que se prestam a ser siglas de aluguel não existem sem que exista alguém que esteja alugando.
É, mas nesse momento vamos precisar descobrir qual é política que se faz para sair da crise da política, porque ela agora cria mais problemas do que resolve.
Portanto, é necessário que se crie um espaço para que a sociedade que não quer participar da vida partidária em termos orgânicos possa também participar da política institucional.
O problema é que não foram esgotados os meios legais| |Medio| |Politica|
392 |Após a eleição, Aécio Neves encaminhou um processo ao Tribunal Superior Eleitoral (TSE), alegando irregularidades no financiamento da campanha dos adversários.
Talvez tenha sido o final de uma temporada, mas o House of Cards brasileiro ainda parece longe da season finale.
O deputado Rodrigo Rocha Loures, o “homem da mala”, pode fechar acordo de delação premiada, detalhando suas relações com o presidente.
O resultado dos ataques foi uma eleição apertada e marcada pela descrença: Dilma foi reeleita| |Alto| |Eleicoes|
394 |Rodrigo Rocha Loures na chegada ao edifício-sede da PF para interrogatório: silêncio orientado pela defesaO silêncio do ex-deputado Rodrigo Rocha Loures aumenta o suspense sobre as informações que pode fornecer à Operação Lava-Jato.
Segundo informações divulgadas pela Polícia Federal, a decisão do magistrado atendeu a um pedido da defesa para que os advogados tivessem mais tempo de avaliar os autos.
O ex-assessor especial do presidente Michel Temer foi levado para depor ontem no edifício-sede da| |Alto| |Crime|
395 |A série histórica realizada há 16 anos aponta que 2012 foi a última vez em que o setor operou no azul.
Satélite setor hoteleiro calcula que a média de ocupação em maio nos 26 maiores estabelecimentos de Salvador, cuja divulgação está prevista para os próximos dias, deve ficar pelo segundo mês consecutivo abaixo dos 50%.
Mata-leãoAs perspectivas indicam que 2017 será novamente um ano perdido para os hoteleiros da cidade.
“O resultado apurado do último dia 31 foi de 41%, muito abaixo do ponto de | |Baixo| |Economia|
397 |Agência Brasil Marina Silva Marina SilvaA ex-senadora Marina Silva (Rede) afirmou que os recursos de caixa dois usados em 2014 transformaram a eleição em uma “fraude eleitoral”.
“É fundamental corrigir a estrutura, o mecanismo que [deveria] inviabilizar essa fraude”, afirmou.
A edição deste ano, da qual participou Marina, foi realizada nos dias 7 e 8 de abril.
“Um dos graves problemas da corrupção é ela inviabilizar a própria democracia.”Marina também falou do possível legado da Lava Jato e da p| |Alto| |Eleicoes|
398 |PolíticaPartidos disputam filiação de Demóstenes Torres ex-senador Demóstenes Torres pretende voltar à política, caso tenha decisões favoráveis em relação à possibilidade de ser elegível novamente.
Só que depois que eu fiz essas declarações, o PSDB já me convidou, o PP abertamente, o senador Wilder me convidou.
Eu posso me filiar porque muita gente confunde e diz que eu não tenho direito político, que meus direitos políticos estão suspensos.
Porque tinha muita gente lá, não vou dizer morto| |Alto| |Politica|
400 |De acordo com a pesquisa, Lula (PT) e Marina Silva (Rede) têm a preferência dos eleitores.
As principais lideranças do PSB em Pernambuco defendem que o partido tenha candidato a presidente da República em 2018, mas, por enquanto, não há um nome no partido que se destaque nacionalmente.
Marina Silva vai ganhar título de cidadã do Recife Ouça Marina Silva pedir a cassação de Dilma e Temer pelo TSEA ex-senadora também tem um ótimo relacionamento com o governador Paulo Câmara (PSB).
Marina Silv| |Baixo| |Eleicoes|
401 |A autoindulgente declaração de respeito às diferenças internas não basta para dar identidade a um partido e justificar sua existência.
ImpeachmentOutra decisão de Marina que foi criticada pelo grupo de opositores foi o apoio ao impeachment da ex-presidente Dilma Rousseff.
Marina iria compor a chapa presidencial com o correligionário Eduardo Campos, que morreu no mesmo ano em um acidente aéreo em Santos.
“O que estava em curso, verdadeiramente, era um deslocamento político da Rede em direção ao b| |Medio| |Eleicoes|
402 |A realidade é que Temer entra para história como o primeiro presidente da República denunciado por corrupção no exercício do mandato", seguiu Marina.
Divulgação 5.mai.2017 - Marina Silva em evento da Rede em 2017Marina Silva, porta-voz do partido Rede, criticou na noite desta terça-feira (27) o pronunciamento do presidente Michel Temer e disse que a saída dele do cargo é "indispensável".
Candidata à presidência nas duas últimas eleições, Marina comentou por meio das redes sociais as afirmações| |Medio| |Politica|
403 |Embolados em segundo aparecem Bolsonaro, com 16%, e Marina, com 15%.
Alckmin amplia vantagem entre os mais ricos (14%), os com 60 anos ou mais (12%) e no Sudeste (12%).
FolhapressO cenário com Doria é similar: Lula, na dianteira, tem 30%, Marina e Bolsonaro, 15% cada um, e o prefeito, 10%.
Ela lidera (27%), seguida por Bolsonaro (18%), Doria (14%) e Ciro (12%).
Hoje, empatados em segundo com 5%, estão PSDB e PMDB.| |Baixo| |Eleicoes|
404 |ex-ministro Antonio Palocci foi condenado nesta segunda-feira a 12 anos e dois meses de prisão por corrupção passiva e lavagem de dinheiro no escândalo da Petrobras.
Mas foi forçado a renunciar em 2006 após se ver envolvido em um escândalo de violação do segredo bancário.
A Constituição estabelece que, quando um presidente é denunciado, dois terços dos deputados devem validar essa denúncia para que o Supremo Tribunal Federal (STF) o processe.
A Justiça também mira o presidente Michel Temer q| |Alto| |Crime|
405 |247 - Em busca de um vice para compor sua chapa visando a eleição presidencial de 2018, a ex-senadora e ex-ministra Marina Silva (Rede) já conversou com a ministro do Supremo Tribunal Federal (STF) Carmen Lúcia para ser sua vice, de acordo com informação publicada na coluna Radar Online.
Na eleição passada, Marina era vice do então candidato ao Palácio do Planalto pelo partido, Eduardo Campos, morto em um trágico acidente aéreo em agosto daquele ano, em Santos (SP).
Este já declarou disse estar | |Baixo| |Politica|
406 |Mas o que está sustentando a Lava Jato é a capacidade técnica que os juízes e os procuradores e os investigadores têm.
E obviamente que o expediente da delação premiada tem dado uma contribuição para que se tenha as pistas para a investigação.
“Exatamente aqueles que nunca se uniram em função de causas para o Brasil agora se unem em favor de detratar a Lava Jato.
Exatamente aqueles que nunca se uniram em função de causas para o Brasil agora se unem em favor de detratar a Lava Jato.
Gostaria que | |Baixo| |Positiva|
407 |Bloomberg afirma que Lula nega as acusações e seus advogados dizem que as alegações fazem parte de uma campanha para desacreditá-lo.
Lula recebeu cerca de 30% da intenção de votos na primeira rodada, de acordo com uma pesquisa da Datafolha.
Moro é o juiz responsável pela investigação da rede corrupção em que Lula é acusado de ter recebido benefícios indevidos de uma empresa de construção em troca de favores que ele concedeu quando presidente, lembra a Bloomberg.
Em simulações para um segundo tur| |Alto| |Corrupcao|
408 |E seu futuro, se depender de um desses três, será sombrio!
E coloque turbidez nessa água: a segunda colocação é disputada pela esfinge Marina Silva (“decifre-a se for capaz”) e Jair Bolsonaro, militar linha-dura que fala e age como se personificasse um cassetete.
Da Justiça nos vem pelo menos o consolo de que, por causa de seus crimes, o ex-presidente - responsável (i)moral pela crise que vivemos - estará inviabilizado para a disputa.
)Eis o labirinto que explica a liderança do ex-presidente nas| |Medio| |Eleicoes|
409 |Em meio à fragilidade do governo membros da base aliada do governo têm pressionado o presidente a abrandar pontos da reforma da Previdência.
O magistrado afirmou ainda que Temer "certamente haverá de concluir" seu mandato, em 2018, "se não vierem fatos novos, robustos".
SÃO PAULO - A semana que deverá marcar a apresentação da denúncia do procurador-geral da República, Rodrigo Janot, contra o presidente Michel Temer começa agitada para o noticiário político.
A condenação do ex-ministro Antonio Pa| |Medio| |Processo-Juridico|
410 |Parte dos organizadores da greve acredita que o combate às reformas angaria mais apoio na sociedade do que a defesa das “Diretas Já”.
Os antipetistas associam as Diretas Já ao Volta, Lula O último Datafolha só fez aumentar esse temor.
Os antipetistas e antilulistas, concentrados nas faixas de maior renda, estão convencidos de que uma antecipação das eleições levaria o ex-presidente de volta ao Palácio do Planalto.
Acuado, raciocina esse grupo do partido, o pee| |Medio| |Politica|
411 |E aqueles que se prestam a ser siglas de aluguel não existem sem que exista alguém que esteja alugando.
É, mas nesse momento vamos precisar descobrir qual é política que se faz para sair da crise da política, porque ela agora cria mais problemas do que resolve.
Portanto, é necessário que se crie um espaço para que a sociedade que não quer participar da vida partidária em termos orgânicos possa também participar da política institucional.
O problema é que não foram esgotados os meios legais, os m| |Medio| |Manifestacao|
412 |O ex-governador do Rio Sérgio Cabral (PMDB-RJ) foi condenado pelo juiz federal Sérgio Moro a 14 anos e 2 meses de prisão por corrupção e lavagem de dinheiro na Operação Lava Jato.
Documento A SENTENÇA DE SÉRGIO CABRAL PDFO magistrado fixou o regime fechado para o início de cumprimento da pena.
Sérgio Cabral, Wilson Carlos e Carlos Miranda estão presos na Lava Jato.
Esta é a primeira condenação de Sérgio Cabral na Lava Jato.
Tampouco há provas que os valores gastos tem origem ilícita nem provas d| |Alto| |Corrupcao|
413 |Órgão Especial do Tribunal de Justiça cassa honraria concedida a Sérgio Cabral Segundo os desembargadores, o ex-governador teve conduta incompatível com a homenagem feita pela instituição.
O ex-governador Sérgio Cabral perdeu a honraria concedida pelo Trbunal de Justiça.
Por Carlos Brito, G1 RioO Órgão Especial do Tribunal de Justiça do Estado do Rio de Janeiro cassou, por unanimidade de votos, o Colar do Mérito Judiciário do ex-governador do Rio Sérgio Cabral.
O Colar é considerado a mais alta | |Alto| |Corrupcao|
414 |No documento entregue à Justiça, há indicações de pagamento ao governador Luiz Fernando Pezão.
RESPOSTAO governador Luiz Fernando Pezão reafirmou que nunca recebeu recursos ilícitos e que continua à disposição da Justiça.
Segundo o relatório, as mensagens "vinculam o governador Luiz Fernando Pezão, do PMDB, à organização".
Na época, Luiz Fernando Pezão era vice-governador do Rio.
Um novo relatório da Polícia Federal, do dia 6 de junho, revela informações retiradas do celular do operador do esque| |Alto| |Crime|
415 |O valor chegou a ser quarenta vezes o declarado por Cabral em seu imposto de renda.
No estabelecimento, Antonio Bernardo confirmou a ida de Gilda para levar até ele joias para avaliação.
Para complicar sua situação e da família Cabral, em seu depoimento, a ex-governanta caiu em contradições.
Depois, revelou que tinha se apoderado dos objetos com medo de não receber os atrasados que Sérgio Cabral estava lhe devendo.
No dia seguinte, a PF recebeu uma denúncia anônima e foi à loja.| |Alto| |Corrupcao|
416 |Adriana e Sérgio gastaram mais de R$ 11 milhões em joalherias, e a maioria das joias ainda não foi encontrada.
A advogada Adriana Ancelmo, mulher do ex-governador do Rio Sérgio Cabral, foi absolvida pela Justiça Federal, em Curitiba, em processo sobre lavagem de dinheiro e corrupção.
Segundo as investigações, joias e pedras preciosas compradas pelo casal são, sim, prova de crime.
Veja na reportagem de Sônia Bridi e Paulo Zero.
O Ministério Público diz que vai recorrer e já apresentou nova denúnc| |Medio| |Processo-Juridico|
417 |O valor corresponde a quase 50% da receita bruta da Survey em 2011, de R$ 534,9 mil.
As investigações identificaram, entre outubro de 2011 e dezembro de 2013, 31 depósitos bancários da Survey em favor da Araras, totalizando R$ 1,266 milhão.
PublicidadeO ex-governador do Rio Sérgio Cabral (PMDB) tornou-se réu pela décima vez consecutiva nesta sexta-feira (2).
Na verdade, os pagamentos eram realizados por orientação de Werneck, que depositava na conta da Survey os valores que seriam repassados a o| |Alto| |Crime|
418 |Arte/UOL Na foto à esquerda, em destaque, o empresário Marco Antonio de Luca em confraternização com Cabral em Paris; com guardanapos na cabeça, estão Sérgio Côrtes (o 1º à direita); Fernando Cavendish (o 3º, da dir.
O empresário teve o passaporte recolhido e ainda foi afastado da empresa por determinação da Justiça.
A ex-primeira dama foi denunciada por lavagem de dinheiro na organização comandada por Cabral.
Em audiência da 7ª Vara Criminal da Justiça Federal do Rio, em maio, Cabral foi questi| |Alto| |Processo-Juridico|
419 |Coronel que já cuidou da segurança de Cabral participava de esquema de corrupção de ex-governador, diz operador Anderson Felippe é diretor de empresa de vigilância que participou de eventos como Copa e Maracanã.
Anderson Felippe Gonçalves, o coronel Felippe, já cuidou da segurança do ex-governador.
Luiz Carlos Bezerra, que está preso desde novembro, disse ao Ministério Público Federal que o coronel Fellipe tinha envolvimento com o dinheiro do caixa da corrupção do ex-governador.
O nome de corone| |Alto| |Corrupcao|
420 |A ação é um desdobramento das investigações da força-tarefa da Operação Lava Jato no Rio.
Os agentes cumprem dois mandados de busca e apreensão, um em Ipanema e outro no Jardim Botânico, bairros da zona sul carioca.
O juiz Marcelo Bretas, da 7ª Vara Federal Criminal, aceitou na última segunda-feira (19) a 11ª denúncia contra Cabral por lavagem de dinheiro a partir da compra de joias em espécie, sem nota fiscal ou certificação nominal.
Uma das ordens judiciais tem como alvo a casa de uma irmã de | |Alto| |Processo-Juridico|
421 |Moro afirmou ainda que Adriana Ancelmo tinha um padrão de vida e de consumo acima do normal, inconsistentes com os rendimentos lícitos dela e do ex-governador.
Na avaliação de Moro, não há qualquer prova de que Adriana Ancelmo tenha participado do acerto da corrupção e seu nome não foi mencionado por nenhum dos delatores.
DA REDAÇÃO (com O Globo) – O juiz Sergio Moro condenou na terça-feira (13) o ex-governador do Rio de Janeiro Sérgio Cabral a 14 anos e dois meses de prisão por lavagem de dinhe| |Alto| |Crime|
422 |Outro deputado presente foi Alceu Moreira (PMDB-RS), um dos cotados para ser indicado relator da denúncia contra Temer na Comissão de Constituição e Justiça (CCJ).
Do núcleo duro do governo, apenas o ministro da Casa Civil, Eliseu Padilha, investigado na Lava-Jato por suspeita de corrupção e lavagem de dinheiro, marcou presença.
BRASÍLIA —| |Alto| |Corrupcao|
423 |Ele acusou a atual gestão da OAB fluminense de ter o que definiu como “grande proximidade entre a diretoria atual da Ordem e o governo estadual na gestão de Cabral”.
ReproduçãoBrasília – As denúncias contra a agência de publicidade Corcovado, envolvida no mesmo esquema de corrupção ligado ao ex-governador fluminense Sérgio Cabral levantaram dúvidas e provocaram guerra interna entre o Sindicato dos Advogados do Rio de Janeiro e a seccional da Ordem dos Advogados do Brasil (OAB-RJ).
Queremos desco| |Alto| |Processo-Juridico|
424 |RIO - Carlos Miranda, acusado de ser operador do esquema de corrupção que envolve o ex-governador do Rio Sérgio Cabral (PMDB-RJ) teve o pedido de liberdade negado nessa quarta-feira pelo Superior Tribunal de Justiça (STJ).
Ele é casado com uma prima do ex-governador e se tornou sócio em uma empresa de comunicação aberta por Cabral em 2003.
Fischer destacou ainda que deixar o réu em liberdade pode prejudicar o rastreamento do dinheiro que teria sido recebido como propina.
A Quinta Turma do Superi| |Alto| |Corrupcao|
425 |Sérgio Cabral foi condenado a 14 anos e 2 meses por corrupção e lavagem de dinheiroO juiz federal Sérgio Moro condenou Cabral (PMDB-RJ) a 14 anos e 2 meses de prisão.
Na ação, o MPRJ também identificou dois presos em outras celas que mantinham dezenas de comprimidos de medicação controlada.
A vistoria ocorreu na segunda-feira (19), mas o resultado só foi divulgado neste sábado (24) pelo MPRJ.
Cabral foi acusado de ter recebido propina de pelo menos R$ 2,7 milhões da empreiteira Andrade Gutierrez| |Alto| |Crime|
426 |A ação é um desdobramento das investigações da Operação Lava Jato.
Nesta sexta-feira (23), a Polícia Federal (PF) realiza uma operação para apreender joias e bens da advogada Adriana Ancelmo, mulher de Cabral.
Até o momento, Dom Orani não recebeu nenhuma intimação, assim como o reverendo, segundo a assessoria do religioso.
O advogado de defesa do ex-governador, Luciano Saldanha, afirmou que não se pronunciará sobre as testemunhas antes que elas sejam ouvidas.| |Medio| |Processo-Juridico|
427 |Le Monde destaca que Cabral é do PMDB, o mesmo partido do presidente Michel Temer, e ingressou na política nos anos 1980.
Matéria publicada pelo jornal francês Le Monde na quarta-feira (14) aponta logo em seu primeiro parágrafo, que dificilmente um político encarnou tão bem a grandeza e a decadência de um país como o ex-governador do Rio de Janeiro, Sergio Cabral, o faz em relação ao Brasil.
A reportagem afirma que Cabral, que antes estava acostumado a festas chiques, viagens de helicóptero e ja| |Medio| |Politica|
428 |Mandato durante o qual o defendente (Sérgio Cabral) tudo fez para alavancar a economia do Rio de Janeiro.
“Fernando Fragoso, Christiano Fragoso, Rodrigo Fragoso e demais advogados que integram o escritório Fragoso Advogados, vêm pela presente dar ciência a V. Exa.
“Sérgio Cabral não deixou a população do Estado do Rio de Janeiro ‘às mínguas’.
O documento é subscrito pelos advogados Fernando Fragoso, Christiano Fragoso, Rodrigo Fragoso, Luciano Saldanha Coelho, Erika Thomaka e Bruna Ingber Mendes| |Baixo| |Positiva|
429 |Preso desde novembro do ano passado, o ex-governador do Rio de Janeiro, Sérgio Cabral (PMDB), tem se revelado imbatível em quebrar recordes.
“Ainda tem muita coisa para vir por aí”, antecipou a VEJA um procurador envolvido nas investigações no Rio de Janeiro.
Para ler a reportagem na íntegra, compre a edição desta semana de VEJA no iOS, Android ou nas bancas.
E aproveite: todas as edições de VEJA Digital por 1 mês grátis no Go Read.
O juiz Sérgio Moro o condenou a 14 anos e dois meses de prisão | |Alto| |Crime|
430 |Lava-JatoTJ do Rio cassa, por unanimidade, Colar do Mérito dado a Sérgio CabralO Órgão Especial do Tribunal de Justiça do Rio acaba de cassar, por unanimidade, o Colar do Mérito Judiciário dado a Sérgio Cabral, por causa da condenação de 13 de junho, pelo juiz Sérgio Moro, a primeira dele até agora na Lava-Jato.
